{
  "artifact_paths": {
    "summary": "summary.json"
  },
  "cost_usd": null,
  "final_status": "clear",
  "finding_counts": {
    "critical": 0,
    "high": 0,
    "low": 0,
    "medium": 0
  },
  "run_id": "fixture-clear",
  "schema_version": "1.0",
  "stopped_reason": "review_clear",
  "suppression_count": 0,
  "top_findings": []
}
